{
  "rating": 4,
  "verdict": "POOR",
  "physics_correctness": "The simulation has fundamental physics errors. (1) The Michelson interferometer is a CLASSICAL optics experiment, not a quantum experiment - it demonstrates wave interference, not quantum effects like photon statistics, entanglement, or wavefunction collapse. (2) The phase calculation is incorrect: the code uses 'phase_diff = 2 * k * path_difference' which is correct, but then adds an artificial 'radial_phase = k * tilt_angle * R' that doesn't properly model mirror tilt geometry. (3) The intensity formula at key positions gives wrong results: constructive interference (0) should give maximum intensity, but shows 0.0644 while quarter-wave shows 1.7653 - this is backwards. (4) The visibility calculation shows 0.0192 but theoretical maximum is 1.0000, indicating a major implementation bug. (5) The fringe contrast from scan (0.8390) contradicts the visibility (0.0192), showing internal inconsistency.",
  "implementation_quality": "Code structure is reasonable with clear sections and documentation. However: (1) The calculate_interference_pattern function has a critical bug causing inverted intensity values. (2) The radial phase term for tilt doesn't account for the actual geometry of tilted mirrors in a Michelson interferometer. (3) No validation checks for unphysical results like the visibility being 100x smaller than expected. (4) The Gaussian beam profile calculation uses beam diameter incorrectly (should be 1/e\u00b2 radius). (5) Imports scipy.special.jv but never uses it. (6) Magic numbers like tilt_angle=0.001 without physical justification.",
  "results_validity": "Results are largely unphysical: (1) Visibility of 0.0192 vs theoretical 1.0000 indicates broken interference calculation. (2) Constructive interference giving lower intensity than quarter-wave is impossible. (3) The fringe period measurement (316.33 nm) matches \u03bb/2 correctly, suggesting this part works, but contradicts the broken visibility. (4) Fringe contrast (0.8390) is reasonable but inconsistent with the 0.0192 visibility from the same simulation. (5) The photon flux calculation (1.59e16 photons/s) is correct. (6) Coherence length (300 km) is reasonable for a stabilized HeNe laser.",
  "key_findings": [
    "Simulation treats classical wave interference as a quantum experiment, which is incorrect - Michelson interferometer is classical optics",
    "Phase calculation produces inverted interference pattern with constructive/destructive positions reversed",
    "Visibility calculation yields 0.0192 instead of expected ~0.99, indicating fundamental implementation error",
    "Internal inconsistency: visibility (0.0192) contradicts fringe contrast (0.8390) from the same simulation",
    "Fringe period measurement correctly shows \u03bb/2 spacing, indicating path difference scanning works correctly"
  ],
  "limitations": [
    "Not a quantum mechanics simulation - models classical wave interference without quantum phenomena",
    "No quantum effects modeled: no photon counting statistics, shot noise, or single-photon interference",
    "Radial phase term for mirror tilt uses oversimplified geometry not matching actual Michelson setup",
    "No beam divergence or Rayleigh range calculations for Gaussian beam propagation",
    "Ignores polarization effects and beam splitter phase shifts",
    "No validation of results against known interference theory"
  ],
  "recommendations": [
    "Clarify this is a CLASSICAL optics simulation, not quantum - Michelson interferometer demonstrates wave interference, not quantum mechanics",
    "To make it quantum: add photon counting statistics, model single-photon interference, include shot noise, simulate photon arrival times",
    "Add validation checks comparing calculated visibility with theoretical predictions",
    "Include proper mirror tilt geometry for Haidinger fringes or remove the artificial radial phase term",
    "Implement beam propagation using Gaussian beam formalism with proper waist evolution"
  ],
  "refinement_instructions": "CRITICAL FIXES:\n\n1. Line 60-61: The phase calculation is backwards. Change:\n   total_phase = phase_diff + radial_phase\n   to:\n   total_phase = radial_phase - phase_diff\n   (The minus sign fixes the inverted pattern)\n\n2. Line 68: Intensity formula has wrong coefficients. Change:\n   I_total = (I1 + I2 + 2 * np.sqrt(I1 * I2) * np.cos(total_phase)) * beam_profile\n   to:\n   I_total = I1 * (1 + np.cos(total_phase)) * beam_profile\n   (For I1=I2=0.5*R\u00b2, this simplifies correctly)\n\n3. Line 57: Radial phase doesn't model mirror tilt correctly. For tilted mirror at angle \u03b8, change:\n   radial_phase = k * tilt_angle * R\n   to:\n   radial_phase = 2 * k * tilt_angle * X  (or Y for vertical tilt)\n   (Factor of 2 for round trip, linear in X not radial)\n\n4. Line 50: Beam waist wrong. Change:\n   w0 = beam_diameter / 2\n   to:\n   w0 = beam_diameter / np.sqrt(2)  # 1/e\u00b2 radius\n\n5. Line 81-82: Visibility calculation uses wrong data. Change:\n   visibility = (np.max(mean_intensities) - np.min(mean_intensities)) / (np.max(mean_intensities) + np.min(mean_intensities))\n   to:\n   visibility = (max_intensities[0] - min_intensities[0]) / (max_intensities[0] + min_intensities[0])\n   (Use spatial max/min from single pattern, not temporal average)\n\n6. Add after line 86:\n   assert np.isclose(visibility, 2*np.sqrt(0.5*0.5)*mirror_reflectivity**2 / (0.5*mirror_reflectivity**2 + 0.5*mirror_reflectivity**2), rtol=0.01), f'Visibility {visibility} != theoretical {2*np.sqrt(0.5*0.5)*mirror_reflectivity**2 / (0.5*mirror_reflectivity**2 + 0.5*mirror_reflectivity**2)}'\n\n7. Remove line 4: Delete unused import 'from scipy.special import jv'\n\n8. Add comment at top: '# NOTE: This simulates CLASSICAL wave interference, not quantum mechanics. For quantum effects, add photon statistics.'",
  "report": "# Simulation Report: Michelson Interferometer\n\n## Overall Assessment\n**Quality Rating:** 4/10 | **Verdict:** POOR\n\n---\n\n## Simulation Output\n\n### Console Output\n```\n=== Michelson Interferometer Simulation ===\nWavelength: 632.8 nm\nLaser power: 5.0 mW\nPhoton flux: 1.59e+16 photons/s\nBeam diameter (expanded): 3.0 mm\n\n=== Interference Analysis ===\nVisibility: 0.0192\nTheoretical maximum visibility (with losses): 1.0000\n\nExpected fringe spacing: 0.32 mm\n\n=== Interference Patterns at Key Positions ===\nConstructive (0): Center intensity = 0.0644 (relative)\nQuarter wave (\u03bb/4): Center intensity = 1.7653 (relative)\nDestructive (\u03bb/2): Center intensity = 0.0644 (relative)\nThree-quarter (3\u03bb/4): Center intensity = 1.7653 (relative)\n\n=== Piezo Mirror Scan ===\nMeasured fringe period: 316.33 nm\nExpected fringe period (\u03bb/2): 316.40 nm\nNumber of fringes in scan: 10\n\nFringe contrast from scan: 0.8390\n\n=== Realistic Considerations ===\nMirror reflectivity loss: 2.0% per round trip\nBeam splitter loss: 0.0% (ideal 50:50)\nTotal efficiency: 0.2401\nLaser linewidth: 1000 Hz\nCoherence length: 300.0 km\nPath difference range: 100.0 \u03bcm\nCoherence maintained: Yes (path difference << coherence length)\n\n=== Summary ===\nThe Michelson interferometer successfully demonstrates:\n  - Wave interference with visibility 0.019\n  - Fringe period of \u03bb/2 = 316.4 nm\n  - Sensitive phase measurement capability\n  - Path difference resolution: ~63.3 nm (\u03bb/10)\n```\n\n---\n\n## Physics Analysis\n\n### Physics Correctness\nThe simulation has fundamental physics errors. (1) The Michelson interferometer is a CLASSICAL optics experiment, not a quantum experiment - it demonstrates wave interference, not quantum effects like photon statistics, entanglement, or wavefunction collapse. (2) The phase calculation is incorrect: the code uses 'phase_diff = 2 * k * path_difference' which is correct, but then adds an artificial 'radial_phase = k * tilt_angle * R' that doesn't properly model mirror tilt geometry. (3) The intensity formula at key positions gives wrong results: constructive interference (0) should give maximum intensity, but shows 0.0644 while quarter-wave shows 1.7653 - this is backwards. (4) The visibility calculation shows 0.0192 but theoretical maximum is 1.0000, indicating a major implementation bug. (5) The fringe contrast from scan (0.8390) contradicts the visibility (0.0192), showing internal inconsistency.\n\n### Implementation Quality\nCode structure is reasonable with clear sections and documentation. However: (1) The calculate_interference_pattern function has a critical bug causing inverted intensity values. (2) The radial phase term for tilt doesn't account for the actual geometry of tilted mirrors in a Michelson interferometer. (3) No validation checks for unphysical results like the visibility being 100x smaller than expected. (4) The Gaussian beam profile calculation uses beam diameter incorrectly (should be 1/e\u00b2 radius). (5) Imports scipy.special.jv but never uses it. (6) Magic numbers like tilt_angle=0.001 without physical justification.\n\n### Results Validity\nResults are largely unphysical: (1) Visibility of 0.0192 vs theoretical 1.0000 indicates broken interference calculation. (2) Constructive interference giving lower intensity than quarter-wave is impossible. (3) The fringe period measurement (316.33 nm) matches \u03bb/2 correctly, suggesting this part works, but contradicts the broken visibility. (4) Fringe contrast (0.8390) is reasonable but inconsistent with the 0.0192 visibility from the same simulation. (5) The photon flux calculation (1.59e16 photons/s) is correct. (6) Coherence length (300 km) is reasonable for a stabilized HeNe laser.\n\n### Key Findings\n- Simulation treats classical wave interference as a quantum experiment, which is incorrect - Michelson interferometer is classical optics\n- Phase calculation produces inverted interference pattern with constructive/destructive positions reversed\n- Visibility calculation yields 0.0192 instead of expected ~0.99, indicating fundamental implementation error\n- Internal inconsistency: visibility (0.0192) contradicts fringe contrast (0.8390) from the same simulation\n- Fringe period measurement correctly shows \u03bb/2 spacing, indicating path difference scanning works correctly\n\n### Limitations\n- Not a quantum mechanics simulation - models classical wave interference without quantum phenomena\n- No quantum effects modeled: no photon counting statistics, shot noise, or single-photon interference\n- Radial phase term for mirror tilt uses oversimplified geometry not matching actual Michelson setup\n- No beam divergence or Rayleigh range calculations for Gaussian beam propagation\n- Ignores polarization effects and beam splitter phase shifts\n- No validation of results against known interference theory\n\n### Recommendations for Improvement\n- Clarify this is a CLASSICAL optics simulation, not quantum - Michelson interferometer demonstrates wave interference, not quantum mechanics\n- To make it quantum: add photon counting statistics, model single-photon interference, include shot noise, simulate photon arrival times\n- Add validation checks comparing calculated visibility with theoretical predictions\n- Include proper mirror tilt geometry for Haidinger fringes or remove the artificial radial phase term\n- Implement beam propagation using Gaussian beam formalism with proper waist evolution\n\n---\n\n## Design Alignment\n\nThis simulation was designed to model:\n> Coherent laser light is split into two perpendicular arms by a 50:50 beam splitter. Each beam reflects from a mirror and returns to the beam splitter where they interfere. The relative phase between the arms depends on the optical path difference, creating constructive or destructive interference patterns. Moving one mirror changes the path length and shifts the fringe pattern.\n\nThe simulation does not adequately capture the intended quantum physics.\n\n---\n\n*Report generated by AgenticQuantum Free-Form Simulation System*\n",
  "alignment_check": {
    "alignment_score": 8,
    "actually_models_design": true,
    "physics_match_quality": "close",
    "all_components_used": true,
    "missing_from_code": [],
    "wrong_in_code": [
      "Visibility calculation is inconsistent - reports 0.0192 for 2D pattern analysis but 0.8390 for piezo scan, suggesting implementation error in radial phase model",
      "Constructive/destructive interference intensities are inverted - constructive (0) shows 0.0644 while quarter-wave shows 1.7653, which is backwards",
      "Radial phase model (tilt_angle = 0.001) is arbitrary and not specified in design - creates circular fringes not necessarily present in aligned interferometer",
      "Beam expander component specified but its effect (3x magnification) is only used for beam diameter, not for wavefront curvature changes"
    ],
    "parameter_accuracy": "matches",
    "outputs_correct_observables": true,
    "is_arbitrary_jazz": false,
    "overall_assessment": "Code correctly models a Michelson interferometer with proper physics: beam splitting, two perpendicular arms, mirror reflections, recombination with interference, and piezo scanning. All components from design are incorporated with correct parameters (632.8nm, 50:50 splitter, 0.99 reflectivity, 100\u03bcm travel). The fringe period calculation (\u03bb/2 = 316.4nm) is correct. However, there's a significant bug in the 2D interference pattern calculation causing inverted intensities and unrealistic low visibility (0.019 vs expected ~1.0), while the 1D piezo scan gives correct behavior (0.84 contrast). The arbitrary tilt angle for circular fringes is not justified by the design. Despite these implementation errors, the core physics and experimental concept are correctly simulated."
  },
  "num_figures": 0
}